abstract,title,category
"This study investigates the effects of climate change on biodiversity patterns in marine ecosystems. We analyzed species composition data from coral reefs across multiple geographical locations over a 10-year period. Our findings show significant shifts in species distribution correlating with temperature increases and ocean acidification levels.","Climate Change Impacts on Marine Biodiversity","biodiversity"
"We conducted a comprehensive analysis of endemic bird species on tropical islands to understand patterns of species richness and endemism. Using field surveys and molecular phylogenetic analysis, we documented the evolutionary relationships among island bird communities.","Island Biogeography and Avian Endemism","biodiversity"
"A novel machine learning approach for protein structure prediction is presented. The method combines deep learning architectures with evolutionary information to achieve state-of-the-art accuracy. We tested our approach on multiple benchmark datasets.","Deep Learning for Protein Structure Prediction","computational"
"Forest fragmentation poses significant threats to tropical biodiversity. We examined the effects of habitat fragmentation on mammalian communities in the Amazon rainforest using camera trap surveys across fragmented and continuous forest areas.","Habitat Fragmentation Effects on Amazonian Mammals","biodiversity"
"The economic impact of tourism on small island states has been extensively studied. This research examines the relationship between tourism revenue and local economic development indicators across Caribbean nations over the past decade.","Tourism Economics in Island States","economics"
"Invasive species management is crucial for biodiversity conservation on islands. We developed and tested novel control strategies for invasive plant species on Pacific islands, evaluating their effectiveness through long-term monitoring programs.","Invasive Species Control on Pacific Islands","biodiversity" 